{
  "type": "matching",
  "introText": "Augmented_Sixth. Use only the index fingers of both hands!",
  "keySignature": "#",
  "key": "iE_",
  "chord": [
    {"visible":[59,71],"hidden":[]},
    {"visible":[60,70],"hidden":[]},
    {"visible":[59,71],"hidden":[]}
  ],
  "reviewText": "",
  "staffDistribution": "keyboard",
  "analysis": {
    "enabled": true,
    "mode": {
      "note_names": false,
      "scientific_pitch": false,
      "scale_degrees": true,
      "solfege": false,
      "roman_numerals": false,
      "intervals": true
    }
  },
  "highlight": {
    "enabled": true,
    "mode": {
      "roothighlight": false,
      "tritonehighlight": false
    }
  }
}
