{
  "type": "matching",
  "introText": "Phrase_Model_Ex1. Prepare “degree five” and go! Use the “mitten” placement of the right hand and use fingers 1-3-2-5 in the left hand.",
  "keySignature": "###",
  "key": "jA_",
  "chord": [
    {"visible":[52,64],"hidden":[]},
    {"visible":[57,61,64,69],"hidden":[]},
    {"visible":[50,62,66,69],"hidden":[]},
    {"visible":[52,62,64,68],"hidden":[]},
    {"visible":[45,61,64,69],"hidden":[]}
  ],
  "reviewText": "",
  "staffDistribution": "keyboard",
  "analysis": {
    "enabled": true,
    "mode": {
      "note_names": false,
      "scientific_pitch": false,
      "scale_degrees": true,
      "solfege": false,
      "roman_numerals": true,
      "intervals": false
    }
  },
  "highlight": {
    "enabled": true,
    "mode": {
      "roothighlight": false,
      "tritonehighlight": false
    }
  }
}
