{
  "type": "matching",
  "introText": "Extend RH finger 5 for lowered scale degree two.",
  "keySignature": "bb",
  "key": "iG_",
  "chord": [
    {"visible":[50,62],"hidden":[]},
    {"visible":[48,60,63,68],"hidden":[]},
    {"visible":[50,60,62,66],"hidden":[]},
    {"visible":[43,58,62,67],"hidden":[]}
  ],
  "reviewText": "",
  "analysis": {
    "enabled": true,
    "mode": {
      "note_names": false,
      "scientific_pitch": false,
      "scale_degrees": true,
      "solfege": false,
      "roman_numerals": true,
      "intervals": false
    }
  },
  "highlight": {
    "enabled": true,
    "mode": {
      "roothighlight": false,
      "tritonehighlight": false,
      "loweredhighlight": true
    }
  }
}
