{
  "type": "matching",
  "introText": "Mitten_Fingers_Minor_Memory. Use fingers 2-3-4-5 to complete the scale fragment per the analysis. The minor key is named at bottom left.",
  "keySignature": "bbb",
  "key": "iC_",
  "chord": [
    {"visible":[67],"hidden":[]},
    {"visible":[],"hidden":[69]},
    {"visible":[],"hidden":[71]},
    {"visible":[],"hidden":[72]},
    {"visible":[],"hidden":[70]},
    {"visible":[],"hidden":[68]},
    {"visible":[],"hidden":[67]}
  ],
  "reviewText": "",
  "staffDistribution": "RH",
  "analysis": {
    "enabled": true,
    "mode": {
      "note_names": false,
      "scientific_pitch": false,
      "scale_degrees": true,
      "solfege": false,
      "roman_numerals": false,
      "intervals": false
    }
  },
  "highlight": {
    "enabled": true,
    "mode": {
      "roothighlight": false,
      "tritonehighlight": false
    }
  }
}
