{
  "type": "matching",
  "introText": "Say-and-play \"scale degree five\" and go!",
  "keySignature": "##",
  "key": "jD_",
  "chord": [
    {"visible":[57,69],"hidden":[],"rhythmValue":"h"},
    {"visible":[67],"hidden":[],"rhythmValue":"h"},
    {"visible":[73],"hidden":[],"rhythmValue":"h"},
    {"visible":[57,69],"hidden":[],"rhythmValue":"w"},
    {"visible":[57,67,69,73],"hidden":[],"rhythmValue":"h"},
    {"visible":[50,66,69,74],"hidden":[],"rhythmValue":"w"}
  ],
  "reviewText": "",
  "staffDistribution": "keyboardPlusRHBias",
  "analysis": {
    "enabled": true,
    "mode": {
      "note_names": false,
      "scientific_pitch": false,
      "scale_degrees": true,
      "solfege": false,
      "roman_numerals": true,
      "intervals": false
    }
  },
  "highlight": {
    "enabled": true,
    "mode": {
      "roothighlight": false,
      "tritonehighlight": false
    }
  }
}
