{
  "type": "matching",
  "introText": "Phrase_Model_Ex1_Memory. Prepare “degree five” and go! Use the “mitten” placement of the right hand and use fingers 1-3-2-5 in the left hand.",
  "keySignature": "bb",
  "key": "jBb",
  "chord": [
    {"visible":[53,65],"hidden":[]},
    {"visible":[],"hidden":[58,62,65,70]},
    {"visible":[],"hidden":[51,63,67,70]},
    {"visible":[],"hidden":[53,63,65,69]},
    {"visible":[],"hidden":[46,62,65,70]}
  ],
  "reviewText": "",
  "staffDistribution": "keyboard",
  "analysis": {
    "enabled": true,
    "mode": {
      "note_names": false,
      "scientific_pitch": false,
      "scale_degrees": true,
      "solfege": false,
      "roman_numerals": true,
      "intervals": false
    }
  },
  "highlight": {
    "enabled": true,
    "mode": {
      "roothighlight": false,
      "tritonehighlight": false
    }
  }
}
