{
  "type": "matching",
  "introText": "Using fingers 2-3-4-5, complete the scale fragment.",
  "keySignature": "##",
  "key": "jD_",
  "chord": [
    {"visible":[69],"hidden":[]},
    {"visible":[71],"hidden":[]},
    {"visible":[73],"hidden":[]},
    {"visible":[74],"hidden":[]}
  ],
  "reviewText": "",
  "analysis": {
    "enabled": true,
    "mode": {
      "note_names": false,
      "scientific_pitch": false,
      "scale_degrees": true,
      "solfege": false,
      "roman_numerals": false,
      "intervals": false
    }
  },
  "highlight": {
    "enabled": true,
    "mode": {
      "roothighlight": false,
      "tritonehighlight": false
    }
  }
}
