{
  "type": "matching",
  "introText": "Mitten_Fingers_Minor. Use fingers 2-3-4-5 to complete the scale fragment per the analysis.",
  "keySignature": "##",
  "key": "iB_",
  "chord": [
    {"visible":[66],"hidden":[]},
    {"visible":[68],"hidden":[]},
    {"visible":[70],"hidden":[]},
    {"visible":[71],"hidden":[]},
    {"visible":[69],"hidden":[]},
    {"visible":[67],"hidden":[]},
    {"visible":[66],"hidden":[]}
  ],
  "reviewText": "",
  "staffDistribution": "RH",
  "analysis": {
    "enabled": true,
    "mode": {
      "note_names": false,
      "scientific_pitch": false,
      "scale_degrees": true,
      "solfege": false,
      "roman_numerals": false,
      "intervals": false
    }
  },
  "highlight": {
    "enabled": true,
    "mode": {
      "roothighlight": false,
      "tritonehighlight": false
    }
  }
}
