{
  "type": "matching",
  "introText": "Exactly as before: Complete the progression indicated by the Roman numerals, in four parts. Use only stepwise or common-tone voice leading in the upper parts, and match the visible bassline.",
  "keySignature": "bb",
  "key": "iG_",
  "chord": [
    {"visible":[55,67,70,62],"hidden":[]},
    {"visible":[48],"hidden":[63,72,67]},
    {"visible":[43],"hidden":[62,70,67]},
    {"visible":[50],"hidden":[62,69,66]},
    {"visible":[43],"hidden":[62,70,67]}
  ],
  "reviewText": "",
  "analysis": {
    "enabled": true,
    "mode": {
      "note_names": false,
      "scientific_pitch": false,
      "scale_degrees": false,
      "solfege": false,
      "roman_numerals": true,
      "intervals": false
    }
  },
  "highlight": {
    "enabled": true,
    "mode": {
      "roothighlight": false,
      "tritonehighlight": false
    }
  }
}
