{
  "type": "matching",
  "introText": "French_Sixth. Prepare “degree five” and go!",
  "keySignature": "bb",
  "key": "iG_",
  "chord": [
    {"visible":[50,62],"hidden":[],"rhythmValue":"w"},
    {"visible":[50,58,62,67],"hidden":[],"rhythmValue":"w"},
    {"visible":[51,57,61,67],"hidden":[],"rhythmValue":"w"},
    {"visible":[50,57,62,66],"hidden":[],"rhythmValue":"w"}
  ],
  "reviewText": "",
  "staffDistribution": "keyboard",
  "analysis": {
    "enabled": true,
    "mode": {
      "note_names": false,
      "scientific_pitch": false,
      "scale_degrees": true,
      "solfege": false,
      "roman_numerals": true,
      "intervals": false
    }
  },
  "highlight": {
    "enabled": true,
    "mode": {
      "roothighlight": false,
      "tritonehighlight": false
    }
  }
}
