{
  "type": "matching",
  "introText": "German_Sixth. Prepare “degree five” and go!",
  "keySignature": "b",
  "key": "iD_",
  "chord": [
    {"visible":[57,69],"hidden":[],"rhythmValue":"w"},
    {"visible":[57,65,69,74],"hidden":[],"rhythmValue":"w"},
    {"visible":[58,65,68,74],"hidden":[],"rhythmValue":"w"},
    {"visible":[57,65,69,74],"hidden":[],"rhythmValue":"h"},
    {"visible":[57,67,69,73],"hidden":[],"rhythmValue":"h"},
    {"visible":[50,65,69,74],"hidden":[],"rhythmValue":"w"}
  ],
  "reviewText": "",
  "staffDistribution": "keyboard",
  "analysis": {
    "enabled": true,
    "mode": {
      "note_names": false,
      "scientific_pitch": false,
      "scale_degrees": true,
      "solfege": false,
      "roman_numerals": true,
      "intervals": false
    }
  },
  "highlight": {
    "enabled": true,
    "mode": {
      "roothighlight": false,
      "tritonehighlight": false
    }
  }
}
