{
  "type": "matching",
  "introText": "Complete the progression indicated by the Roman numerals, in four parts. Use only stepwise or common-tone voice leading in the upper parts, and match the visible bassline.",
  "keySignature": "",
  "key": "jC_",
  "chord": [
    {"visible":[48,72,64,67],"hidden":[]},
    {"visible":[53],"hidden":[69,65,72]},
    {"visible":[48],"hidden":[67,64,72]},
    {"visible":[55],"hidden":[67,62,71]},
    {"visible":[48],"hidden":[67,64,72]}
  ],
  "reviewText": "The following exercises ask you to complete I窶的V窶的窶天窶的 in other keys, both major and minor, with key signatures of up to two sharps or flats.",
  "analysis": {
    "enabled": true,
    "mode": {
      "note_names": false,
      "scientific_pitch": false,
      "scale_degrees": false,
      "solfege": false,
      "roman_numerals": true,
      "intervals": false
    }
  },
  "highlight": {
    "enabled": true,
    "mode": {
      "roothighlight": false,
      "tritonehighlight": false
    }
  }
}
